{
  "schemaVersion": 1,
  "code": "pt-BR",
  "nativeName": "Português (Brasil)",
  "englishName": "Portuguese (Brazil)",
  "culture": "pt-BR",
  "direction": "ltr",
  "strings": {
    "credits.history": "Créditos",
    "credits.balance": "Saldo",
    "credits.observed": "Redução observada",
    "credits.chart": "Reduções do saldo de créditos",
    "credits.units": "créditos",
    "credits.empty": "Leia dois saldos válidos para ver o consumo observado.",
    "credits.history_help": "Somente reduções observadas. Compras, concessões, vencimento e ajustes podem afetar o saldo; este não é um extrato de cobrança. Horários em KST.",
    "credits.allow": "Permitir uso de créditos",
    "credits.allow_help": "Desativado: ao chegar a 0% da cota incluída, tenta uma conta elegível. Se a troca automática não for possível, salva as conversas e fecha o Codex local normalmente. Verificado nas atualizações de uso; não bloqueia cobranças de outros dispositivos ou da nuvem.",
    "credits.paused": "Codex pausado para evitar consumo de créditos",
    "credits.resume_blocked": "O uso de créditos está desativado. Atualize uma conta com cota normal ou permita créditos antes de retomar.",
    "credits.reading": "Leitura {0:MM/dd HH:mm:ss} KST\nSaldo {1} créditos\nRedução observada {2} créditos",
    "credits.interval": "Intervalo {0:MM/dd HH:mm}–{1:MM/dd HH:mm} KST",
    "credits.unknown_interval": "Sem intervalo contínuo de observação",
    "credits.waiting": "A proteção aguarda a conexão com o Codex; o fechamento normal ainda não foi confirmado.",
    "credits.invalid_chats": "Os identificadores salvos são ambíguos; o Codex não foi fechado.",
    "auto.title": "Auto Switch",
    "auto.next": "Próxima: {0}",
    "auto.next_unavailable": "Próxima: nenhuma conta elegível",
    "auto.optimal": "Vencimento mais próximo primeiro",
    "auto.custom": "Prioridade personalizada",
    "auto.priority": "Prioridade {0}",
    "auto.priority_help": "Defina a ordem no menu de cada conta. Contas indisponíveis são ignoradas.",
    "auto.order": "Ordem das contas",
    "auto.ranked_account": "{0}. {1}",
    "subscription.ends": "Expira",
    "subscription.left": "Dias restantes",
    "subscription.expired_days": "Expirou há {0}d",
    "account.relogin": "Entrar novamente no navegador",
    "account.relogin_mismatch": "Entre com a conta selecionada. As contas existentes foram preservadas.",
    "auto.on": "Troca auto. de conta: Ligada",
    "auto.off": "Troca auto. de conta: Desligada",
    "auto.enable": "Troca automática de conta",
    "auto.help": "Troca abaixo de {0}% após atualizar. Compara apenas cotas recentes equivalentes; intervalo de 5 minutos. Falhas pausam a troca e preservam a recuperação.",
    "auto.threshold": "Abaixo de {0}% restante",
    "auto.paused": "Troca automática pausada. Use Recuperar na conta pendente.",
    "switch.recover": "Recuperar",
    "switch.restart_failed": "Não foi possível reiniciar Codex. Tente Recuperar: {0}",
    "io.read": "Leitura do disco",
    "io.write": "Gravação do disco",
    "io.pending": "Medindo E/S do disco…",
    "io.denied": "Acesso à E/S do disco negado.",
    "io.unsupported": "Esta plataforma não oferece coleta de E/S do disco.",
    "io.unavailable": "E/S do disco indisponível ou desatualizada.",
    "io.no_seek": "O dispositivo informa ausência de penalidade de busca.",
    "io.seek": "O dispositivo informa penalidade de busca.",
    "io.mixed": "Os discos subjacentes têm características mistas.",
    "io.unknown_profile": "Características do dispositivo desconhecidas.",
    "io.rates": "Leitura {0} · Gravação {1}",
    "io.latency": "Latência de leitura/gravação: {0} / {1} ms",
    "io.busy": "Volume ocupado: {0}%",
    "io.scale": "Escala: pico observado em 60 segundos, {0}; não é capacidade nominal.",
    "io.policy": "Política de latência: aviso {0} ms / alta {1} ms, com ≥80% ocupado durante 60 segundos.",
    "io.no_limits": "Sem aviso de latência quando o perfil do dispositivo é ambíguo.",
    "io.not_health": "Barra esquerda: leitura. Direita: gravação. As cores indicam pressão de E/S contínua, não falha.",
    "msg.linux_start_codex": "Iniciar Codex",
    "msg.linux_desktop_ready": "Inicie o Codex aqui antes de trabalhar. A troca de conta continua manual.",
    "msg.linux_cli_only": "Somente CLI: contas e uso; sem retomada de chats do desktop.",
    "msg.linux_desktop_unmanaged": "Encerre o Codex normalmente e inicie-o aqui. Não é possível verificar a inicialização atual.",
    "msg.language": "Idioma",
    "msg.language_settings": "Configurações de idioma",
    "msg.importing_the_current_login": "Importando o login atual…",
    "msg.add_account": "Adicionar conta",
    "msg.import_current_account": "Importar conta atual",
    "msg.refresh": "Atualizar",
    "msg.cancel_sign_in": "Cancelar login",
    "msg.cancel_switch": "Cancelar troca",
    "msg.refresh_every_60s": "Atualizar a cada 60 s",
    "msg.codex_accounts": "Contas do Codex",
    "msg.check_usage_and_reset_times_for": "Veja o uso e os horários de redefinição de cada conta.",
    "msg.accounts_switch_after_codex_exits_closing": "A conta é trocada após o Codex fechar. Ao fechar esta janela, o utilitário continua na bandeja.",
    "msg.accounts_usage": "Contas / Uso",
    "msg.light": "Claro",
    "msg.dark": "Escuro",
    "msg.switch_burn0_theme": "Trocar tema Burn0",
    "msg.minimize": "Minimizar",
    "msg.maximize_restore": "Maximizar / Restaurar",
    "msg.close_to_tray": "Fechar para a bandeja",
    "msg.checking_codex_accounts": "Verificando contas do Codex…",
    "msg.operation_cancelled": "Operação cancelada.",
    "msg.refreshing_usage_you_can_keep_using": "Atualizando o uso… Você pode continuar usando outros recursos.",
    "msg.sign_in_to_the_account_you": "Entre no navegador com a conta que deseja adicionar.",
    "msg.signing_in": "Entrando…",
    "msg.signed_in_refreshing_this_account_s": "Login concluído. Atualizando o uso desta conta.",
    "msg.accounts": "{0} contas",
    "msg.1_account": "1 conta",
    "msg.refreshing": "Atualizando {0}",
    "msg.import_the_current_account_or_sign": "Importe a conta atual ou entre com outra conta.",
    "msg.refresh_this_account_now": "Atualizar esta conta agora",
    "msg.refreshing_the_selected_account": "Atualizando a conta selecionada…",
    "msg.switch_queued": "Troca na fila",
    "msg.apply_login": "Aplicar login",
    "msg.in_use": "Em uso",
    "msg.switch": "Trocar",
    "msg.rename_or_remove_account": "Renomear ou remover conta",
    "msg.current_login": "Login atual",
    "msg.saved_account": "Conta salva",
    "msg.new_login_awaiting_application": "Novo login aguardando aplicação",
    "msg.refreshing.2": "Atualizando…",
    "msg.loading_usage": "Carregando uso…",
    "msg.no_usage_data": "Sem dados de uso",
    "msg.no_quota_window_data_was_provided": "Não foram fornecidos dados do período de cota.",
    "msg.unlimited_credits": "Créditos ilimitados",
    "msg.credits": "Créditos {0}",
    "msg.a_usage_or_spending_limit_has": "Um limite de uso ou gasto foi atingido.",
    "msg.the_server_is_not_allowing_ordinary": "O servidor não está permitindo o uso normal.",
    "msg.updated": "Atualizado {0:MM/dd HH:mm:ss}",
    "msg.reset_credits": "{0} créditos de redefinição",
    "msg.1_reset_credit": "1 crédito de redefinição",
    "msg.refresh_failed_showing_previous_data": "Falha ao atualizar · Dados anteriores\n{0}",
    "msg.used_remaining": "Usado {0:0.#}% · Restante {1:0.#}%",
    "msg.rename_account": "Renomear conta",
    "msg.remove_account": "Remover conta",
    "msg.remove_the_saved_account": "Remover a conta salva {0}?",
    "msg.remove_saved_account": "Remover conta salva",
    "msg.removing_the_saved_account": "Removendo a conta salva…",
    "msg.saved_account_removed": "Conta salva removida.",
    "msg.account_display_name": "Nome de exibição da conta",
    "msg.enter_a_name_to_display_instead": "Informe um nome para exibir no lugar do endereço de e-mail.",
    "msg.cancel": "Cancelar",
    "msg.save": "Salvar",
    "msg.ok": "OK",
    "msg.switch_to": "Trocar para {0}?",
    "msg.finish_your_work_then_choose_quit": "Conclua seu trabalho e selecione Sair no menu do Codex. O utilitário trocará de conta e reabrirá o Codex após ele fechar.",
    "msg.the_account_will_be_applied_and": "A conta será aplicada e o Codex será aberto.",
    "msg.this_also_affects_codex_cli_and": "Isso também afeta o Codex CLI e as extensões de IDE que compartilham o arquivo de login.",
    "msg.switch_codex_account": "Trocar conta do Codex",
    "msg.switch_queued_quit_codex_from_its": "Troca na fila. Saia do Codex pelo menu do aplicativo.",
    "msg.switching_to_the_selected_account": "Trocando para a conta selecionada…",
    "msg.queued_switch_cancelled": "Troca na fila cancelada.",
    "msg.applying_the_account_and_opening_codex": "Aplicando a conta e abrindo o Codex…",
    "msg.account_applied_and_codex_opened": "Conta aplicada e Codex aberto.",
    "msg.accounts_could_not_be_refreshed_check": "Não foi possível atualizar {0} contas. Confira os dados anteriores e as mensagens de cada conta.",
    "msg.usage_refreshed": "Uso atualizado.",
    "msg.open_account_manager": "Abrir gerenciador de contas",
    "msg.refresh_usage": "Atualizar uso",
    "msg.refreshing.3": "Atualizando",
    "msg.remaining": "Restante {0:0.#}%",
    "msg.cancel_queued_switch": "Cancelar troca na fila",
    "msg.quit_utility": "Sair do utilitário",
    "msg.no_login_information": "Sem informações de login",
    "msg.email_unavailable": "E-mail indisponível",
    "msg.quota_window": "Período de cota",
    "msg.weekly": "Semanal",
    "msg.daily": "Diário",
    "msg.days": "{0} dias",
    "msg.hours": "{0} horas",
    "msg.1_hour": "1 hora",
    "msg.minutes": "{0} minutos",
    "msg.1_minute": "1 minuto",
    "msg.resets_kst": "Redefinição {0:MM/dd HH:mm} (KST)",
    "msg.reset_time_unavailable": "Horário de redefinição indisponível",